title,slug,headline,logo,description,url,doi,platform,start_date,end_date,status,monetary_incentive,publication_incentive,speaking_incentive,other_incentive,file_submission,container_submission,notebook_submission,other_submission
Parse2022,Parse2022,,https://rumc-gcorg-p-public.s3.amazonaws.com/logos/challenge/658/logo.jpg,"It is of significant clinical interest to study pulmonary artery structures in the field of medical image analysis. One prerequisite step is to segment pulmonary artery structures from CT with high accuracy and low time-consuming. The segmentation of pulmonary artery structures benefits the quantification of its morphological changes for diagnosis of pulmonary hypertension and thoracic surgery. However, due to the complexity of pulmonary artery topology, automated segmentation of pulmonary artery topology is a challenging task. Besides, the open accessible large-scale CT data with well labeled pulmonary artery are scarce (The large variations of the topological structures from different patients make the annotation an extremely challenging process). The lack of well labeled pulmonary artery hinders the development of automatic pulmonary artery segmentation algorithm. Hence, we try to host the first Pulmonary ARtery SEgmentation challenge in MICCAI 2022 (Named Parse2022) to start a new research topic.",https://parse2022.grand-challenge.org/,,Grand Challenge,2023-06-30,,active,True,True,True,FALSE,True,False,FALSE,FALSE
TDSC-ABUS2023,TDSC-ABUS2023,,https://rumc-gcorg-p-public.s3.amazonaws.com/logos/challenge/662/logo.png,"Tumor Detection, Segmentation  and Classification Challenge on  Automated 3D Breast Ultrasound",https://tdsc-abus2023.grand-challenge.org/,,Grand Challenge,2023-07-15,2023-08-20,completed,True,True,True,FALSE,True,False,FALSE,FALSE
INSTANCE2022,instance,,https://rumc-gcorg-p-public.s3.amazonaws.com/logos/challenge/667/Logo_%E9%A1%B5%E9%9D%A2_2.png,The 2022 Intracranial Hemorrhage Segmentation Challenge on Non-Contrast head CT (NCCT),https://instance.grand-challenge.org/,https://doi.org/10.1109/jbhi.2021.3103850,Grand Challenge,2022-07-14,,active,True,True,True,FALSE,True,False,FALSE,FALSE
BCNB,BCNB,,https://rumc-gcorg-p-public.s3.amazonaws.com/logos/challenge/668/BCNB-logo_CUGMa0V.png,Early Breast Cancer Core-Needle Biopsy WSI Dataset,https://bcnb.grand-challenge.org/,https://doi.org/10.3389/fonc.2021.759007,Grand Challenge,,,completed,False,False,False,FALSE,True,False,FALSE,FALSE
RAVIR,RAVIR,,https://rumc-gcorg-p-public.s3.amazonaws.com/logos/challenge/673/IR_Case_022.png,A dataset for  semantic segmentation and quantitative analysis of retinal arteries and veins in infrared reflectance imaging,https://ravir.grand-challenge.org/,https://doi.org/10.1109/jbhi.2022.3163352,Grand Challenge,2022-07-18,,active,False,False,False,FALSE,True,False,FALSE,FALSE
DFUC 2022,DFUC2022,,https://rumc-gcorg-p-public.s3.amazonaws.com/logos/challenge/674/footsnap_logo.png,"Diabetes is a global epidemic affecting around 425 million people and expected to rise to 629 million by 2045. Diabetic Foot Ulcer (DFU) is a severe condition that can result from the disease. The rise of the condition over the last decades is a challenge for healthcare systems. Cases of DFU usually lead to severe conditions that greatly prolongs treatment and result in limb amputation or death. Recent research focuses on creating detection algorithms to monitor their condition to improve patient care and reduce strain on healthcare systems. Work between Manchester Metropolitan University, Lancashire Teaching Hospitals and Manchester University NHS Foundation Trust has created an international repository of up to 11,000 DFU images. Analysis of ulcer regions is a key for DFU management. Delineation of ulcers is time-consuming. With effort from the lead scientists of the UK, US, India and New Zealand, this challenge promotes novel work in DFU segmentation and promote interdisciplinary researcher collaboration.",https://dfuc2022.grand-challenge.org/,https://arxiv.org/abs/2204.11618,Grand Challenge,2022-06-20,,active,False,False,True,FALSE,True,False,FALSE,FALSE
ATLAS R2.0 - Stroke Lesion Segmentation,ATLAS,,https://rumc-gcorg-p-public.s3.amazonaws.com/logos/challenge/676/ATLAS_Logo_square.png,Anatomical Tracings of Lesions After Stroke,https://atlas.grand-challenge.org/,https://doi.org/10.1101/2021.12.09.21267554,Grand Challenge,2022-09-18,,completed,False,True,True,FALSE,True,True,FALSE,FALSE
SynthRAD2023,SynthRAD2023,,https://rumc-gcorg-p-public.s3.amazonaws.com/logos/challenge/678/SynthRAD_square_logo_MnAqldI.png,SynthRAD is the first challenge on automatic generation of synthetic computed tomography (sCT) for radiotherapy,https://synthrad2023.grand-challenge.org/,https://doi.org/10.1002/mp.16529,Grand Challenge,2023-07-15,2028-09-20,active,False,True,True,FALSE,True,True,FALSE,FALSE
3D Teeth Scan Segmentation and Labeling Challenge MICCAI2022,3DTeethSeg,,https://rumc-gcorg-p-public.s3.amazonaws.com/logos/challenge/680/Grand-Challenge-Logo_2.jpg,"Computer-aided design (CAD) tools have become increasingly popular in modern dentistry for highly accurate treatment planning. In particular, in orthodontic CAD systems, advanced intraoral scanners (IOSs) are now widely used as they provide precise digital surface models of the dentition. Such models can dramatically help dentists simulate teeth extraction, move, deletion, and rearrangement and therefore ease the prediction of treatment outcomes.   Although IOSs are becoming widespread in clinical dental practice, there are only few contributions on teeth segmentation/labeling available in the literature and no publicly available database.  A fundamental issue that appears with IOS data is the ability to reliably segment and identify teeth in scanned observations. Teeth segmentation and labelling is difficult as a result of the inherent similarities between teeth shapes as well as their ambiguous positions on jaws.",https://3dteethseg.grand-challenge.org/,,Grand Challenge,2022-07-01,2022-08-15,completed,False,True,False,FALSE,False,True,FALSE,FALSE
MICCAI FLARE 2022,FLARE22,,https://rumc-gcorg-p-public.s3.amazonaws.com/logos/challenge/683/challenge-logo_xJtvQKE.png,MICCAI 2022 Fast and Low-resource semi-supervised  Abdominal oRgan sEgmentation (FLARE) Challenge,https://flare22.grand-challenge.org/,https://doi.org/10.1109/tpami.2021.3100536,Grand Challenge,2023-01-01,,active,True,True,True,FALSE,True,False,FALSE,FALSE
AGGC22,AGGC22,,https://rumc-gcorg-p-public.s3.amazonaws.com/logos/challenge/684/logo_yEwrCqI.PNG,,https://aggc22.grand-challenge.org/,,Grand Challenge,2022-06-29,,active,True,True,True,FALSE,True,False,FALSE,FALSE
autoPET,autoPET,,https://rumc-gcorg-p-public.s3.amazonaws.com/logos/challenge/686/autopet-5.png,Automatic lesion segmentation in whole-body FDG-PET/CT,https://autopet.grand-challenge.org/,,Grand Challenge,2022-05-02,2022-09-04,completed,True,True,True,FALSE,False,True,FALSE,FALSE
ACROBAT 2023,ACROBAT,,https://rumc-gcorg-p-public.s3.amazonaws.com/logos/challenge/687/final_logo_1280x1280_qgi9ILO.png,The ACROBAT challenge aims to advance the development of WSI registration algorithms that can align WSIs of IHC-stained breast cancer tissue sections to corresponding tissue regions that were stained with H&E. All WSIs originate from routine diagnostic workflows.,https://acrobat.grand-challenge.org/,,Grand Challenge,2022-06-15,,active,True,False,False,FALSE,True,False,FALSE,FALSE
SurgT: Surgical Tracking,SurgT,,https://rumc-gcorg-p-public.s3.amazonaws.com/logos/challenge/688/Screenshot_from_2022-06-27_09-41-30.png,This challenge consists of surgical videos with a target bounding box and the participants are expected to develop visual tracking algorithms to estimate the trajectory of the bounding box throughout the video-sequence.,https://surgt.grand-challenge.org/,,Grand Challenge,,,completed,True,True,True,FALSE,False,False,FALSE,FALSE
Surface Learning for Clinical Neuroimaging,SLCN,,https://rumc-gcorg-p-public.s3.amazonaws.com/logos/challenge/689/SLCN_Logo.png,Prediction of developmental phenotypes (age at birth and cognitive test scores) from cortical surface imaging data,https://slcn.grand-challenge.org/,https://doi.org/10.1016/j.neuroimage.2018.01.054,Grand Challenge,2022-04-24,2022-07-15,completed,True,True,False,FALSE,False,True,FALSE,FALSE
Preoperative to Intraoperative Laparoscopy Fusion,P2ILF,,https://rumc-gcorg-p-public.s3.amazonaws.com/logos/challenge/690/logo_V3.png,Preoperative to Intraoperative Laparoscopy Fusion,https://p2ilf.grand-challenge.org/,,Grand Challenge,2022-09-02,2022-09-14,completed,True,True,False,FALSE,False,True,FALSE,FALSE
MICCAI HECKTOR 2022,HECKTOR,,https://rumc-gcorg-p-public.s3.amazonaws.com/logos/challenge/691/grandchallenge_logo_d8JNqKz.png,Automatic Head and Neck Tumor Segmentation and Outcome Prediction in PET/CT Images,https://hecktor.grand-challenge.org/,https://doi.org/10.1007/978-3-030-98253-9,Grand Challenge,2022-08-26,2026-05-01,active,True,True,True,FALSE,True,False,FALSE,FALSE
K2S: from undersampled K-space To automatic Segmentation,K2S,,https://rumc-gcorg-p-public.s3.amazonaws.com/logos/challenge/692/K2S_gradient_5AE5wa5.png,K2S: from undersampled K-space To automatic Segmentation,https://k2s.grand-challenge.org/,https://doi.org/10.1148/ryai.2021200165,Grand Challenge,2022-05-16,2022-06-16,completed,True,True,True,FALSE,True,False,FALSE,FALSE
Diabetic Retinopathy Analysis Challenge MICCAI2022,DRAC22,,https://rumc-gcorg-p-public.s3.amazonaws.com/logos/challenge/694/logo_kT1YYna.png,"Diabetic Retinopathy (DR) lesions segmentation, image quality assessment and classification of proliferatived DR (PDR) and non-PDR in ultra-wide optical coherence tomography angiography mosaic (UW-OCTA-M) images",https://drac22.grand-challenge.org/,,Grand Challenge,2022-08-07,,active,False,True,True,FALSE,True,False,FALSE,FALSE
Multi-Modality Abdominal Multi-Organ Segmentation Challenge 2022,AMOS22,,https://rumc-gcorg-p-public.s3.amazonaws.com/logos/challenge/695/AMOS_2022.png,,https://amos22.grand-challenge.org/,,Grand Challenge,2022-10-09,2060-12-31,active,True,True,True,FALSE,True,False,FALSE,FALSE
Surgical Tool Localization in endoscopic videos,SurgToolLoc,,https://rumc-gcorg-p-public.s3.amazonaws.com/logos/challenge/698/grand-challenge_logo.png,,https://surgtoolloc.grand-challenge.org/,,Grand Challenge,2022-08-29,2022-09-08,completed,True,True,False,FALSE,False,True,FALSE,FALSE
Brain shift with Intraoperative Ultrasound - Segmentation tasks,curious2022,,https://rumc-gcorg-p-public.s3.amazonaws.com/logos/challenge/699/CuRIOUS_logo.png,,https://curious2022.grand-challenge.org/,,Grand Challenge,2022-08-15,2022-09-13,completed,False,False,False,FALSE,True,False,FALSE,FALSE
Carotid Vessel Wall Segmentation and Atherosclerosis Diagnosis,vessel-wall-segmentation-2022,,https://rumc-gcorg-p-public.s3.amazonaws.com/logos/challenge/700/%E5%9B%BE%E7%89%871.png,,https://vessel-wall-segmentation-2022.grand-challenge.org/,,Grand Challenge,2022-07-08,2022-08-01,completed,True,True,True,FALSE,True,False,FALSE,FALSE
Cross-Modality Domain Adaptation: Segmentation & Classification,crossmoda2022,,https://rumc-gcorg-p-public.s3.amazonaws.com/logos/challenge/701/squarelogo_2022.png,The CrossMoDA 2022 challenge is the second edition of the first large and multi-class medical dataset for unsupervised cross-modality Domain Adaptation.,https://crossmoda2022.grand-challenge.org/,,Grand Challenge,2022-05-11,,active,False,True,False,FALSE,True,False,FALSE,FALSE
"Multi-site, Multi-Domain Airway Tree Modeling (ATM’22)",ATM22,,https://rumc-gcorg-p-public.s3.amazonaws.com/logos/challenge/702/logo_xqf7twK.png,"Airway segmentation is a crucial step for the analysis of pulmonary diseases including asthma, bronchiectasis, and emphysema. The accurate segmentation based on X-Ray computed tomography (CT) enables the quantitative measurements of airway dimensions and wall thickness, which can reveal the abnormality of patients with chronic obstructive pulmonary disease (COPD). Besides, the extraction of patient-specific airway models from CT images is required for navigatiisted surgery.",https://atm22.grand-challenge.org/,https://doi.org/10.1007/978-3-030-32226-7_24,Grand Challenge,2022-08-17,,active,False,True,True,FALSE,True,False,FALSE,FALSE
FH-PS-AOP challenge,PS-FH-AOP-2023,,https://rumc-gcorg-p-public.s3.amazonaws.com/logos/challenge/703/F2_WDBTbsq.tif,Fetal Head and Pubic Symphysis Segmentation Challenge,https://ps-fh-aop-2023.grand-challenge.org/,https://doi.org/10.1155/2022/5192338,Grand Challenge,2023-03-27,2023-09-20,completed,True,True,False,FALSE,False,True,FALSE,FALSE
Shifts Challenge 2022,shifts,,https://rumc-gcorg-p-public.s3.amazonaws.com/logos/challenge/704/logo_1200.png,"The goal of the Shifts Challenge 2022 is to raise awareness among the research community about the problems of distributional shift, robustness, and uncertainty estimation, and to identify new solutions to address them. The competition will consist of two new tracks:  White Matter Multiple Sclerosis (MS) lesion segmentation in 3D Magnetic Resonance Imaging (MRI) of the brain  and Marine cargo vessel power estimation.",https://shifts.grand-challenge.org/,https://arxiv.org/abs/2206.15407,Grand Challenge,2022-09-15,2024-04-08,completed,False,False,False,FALSE,False,True,FALSE,FALSE
ACMMM MEGC2022: Facial Micro-Expression Grand Challenge,MEGC2022,,https://rumc-gcorg-p-public.s3.amazonaws.com/logos/challenge/705/acmmm2022_logo.png,Spotting Facial Macro- and Micro-Expressions in Long Videos,https://megc2022.grand-challenge.org/,https://doi.org/10.1109/taffc.2016.2573832,Grand Challenge,2022-05-23,,active,False,True,False,FALSE,True,False,FALSE,FALSE
MItosis DOmain Generalization Challenge 2022,MIDOG2022,,https://rumc-gcorg-p-public.s3.amazonaws.com/logos/challenge/706/midog_compact.png,,https://midog2022.grand-challenge.org/,https://doi.org/10.5281/zenodo.6362337,Grand Challenge,2022-08-04,2022-08-30,completed,False,True,False,FALSE,False,True,FALSE,FALSE
Ischemic Stroke Lesion Segmentation Challenge,isles22,,https://rumc-gcorg-p-public.s3.amazonaws.com/logos/challenge/707/Slide1_N1qHO1K.png,,https://isles22.grand-challenge.org/,,Grand Challenge,2022-07-15,2030-12-06,active,False,False,True,FALSE,False,True,FALSE,FALSE
Cell Segmentation in Multi-modality Microscopy Images,NeurIPS22-CellSeg,,https://rumc-gcorg-p-public.s3.amazonaws.com/logos/challenge/708/logo_EOVfhip.PNG,Weakly Supervised Cell Segmentation in Multi-modality High-resolution Microscopy Images,https://neurips22-cellseg.grand-challenge.org/,,Grand Challenge,2023-08-01,,active,False,True,True,FALSE,True,False,FALSE,FALSE
Breast Cancer Immunohistochemical Image Generation Challenge,bci,,https://rumc-gcorg-p-public.s3.amazonaws.com/logos/challenge/711/logo.png,The Breast Cancer Immunohistochemical Image Generation Challenge aims to directly generate IHC-stained breast cancer histopathology images from HE-stained  images.,https://bci.grand-challenge.org/,,Grand Challenge,2022-08-24,,active,False,True,False,FALSE,True,False,FALSE,FALSE
Fully Automated Radiotherapy Treatment Planning Challenge,AUTO-RTP,,https://rumc-gcorg-p-public.s3.amazonaws.com/logos/challenge/713/AUTO-RTP_Logo.png,Evaluating fully automated external beam radiotherapy treatment planning in prostate cancer,https://auto-rtp.grand-challenge.org/,,Grand Challenge,2023-06-05,,active,False,False,True,FALSE,True,False,FALSE,FALSE
Project AIR - commercial AI for bone age prediction on hand XR,pairboneage22,,https://rumc-gcorg-p-public.s3.amazonaws.com/logos/challenge/715/bone-age-hand-xr-logo.png,Head-to-head performance evaluation of commercially available AI products. This challenge shows the results for bone age prediction on hand radiographs on a multicenter dataset (seven centers) from the Netherlands.,https://pairboneage22.grand-challenge.org/,,Grand Challenge,,2024-01-08,completed,False,False,False,FALSE,True,False,FALSE,FALSE
PAIP 2023: TC prediction in pancreatic and colon cancer,2023PAIP,,https://rumc-gcorg-p-public.s3.amazonaws.com/logos/challenge/716/PAIP2023-640.png,Tumor cellularity prediction in pancreatic cancer (supervised learning) and colon cancer (transfer learning),https://2023paip.grand-challenge.org/,,Grand Challenge,2023-02-15,,active,False,True,True,FALSE,True,False,FALSE,FALSE
SNEMI3D: 3D Segmentation of neurites in EM images,SNEMI3D,,https://rumc-gcorg-p-public.s3.amazonaws.com/logos/challenge/717/logo.png,"The challenge is organized in the context of the IEEE International Symposium on Biomedical Imaging, 2013. The old evaluation site (http://brainiac2.snemi3d.org/SNEMI3D/) will be replaced by this one.",https://snemi3d.grand-challenge.org/,,Grand Challenge,,,active,False,True,True,FALSE,True,False,FALSE,FALSE
The Head and Neck Organ-at-Risk CT & MR Segmentation Challenge,HaN-Seg2023,,https://rumc-gcorg-p-public.s3.amazonaws.com/logos/challenge/718/logo.jpg,A semantic multimodal segmentation challenge comprising 30 organs at risk,https://han-seg2023.grand-challenge.org/,,Grand Challenge,2023-03-26,,active,True,False,False,FALSE,False,True,FALSE,FALSE
Endometrial Carcinoma Detection in Pipelle biopsies,ENDO-AID,,https://rumc-gcorg-p-public.s3.amazonaws.com/logos/challenge/719/logo-challenge.png,"Evaluation platform as reference benchmark for algorithms that can predict endometrial carcinoma on whole-slide images of Pipelle sampled endometrial slides stained in H&E, based on the test data set used in our project.",https://endo-aid.grand-challenge.org/,,Grand Challenge,,,active,False,False,False,FALSE,True,False,FALSE,FALSE
Robust Non-rigid Registration Challenge for Expansion Microscopy,RnR-ExM,,https://rumc-gcorg-p-public.s3.amazonaws.com/logos/challenge/720/RnR-ExM_Logo.png,,https://rnr-exm.grand-challenge.org/,,Grand Challenge,2023-02-17,2028-03-16,active,False,True,True,FALSE,True,False,FALSE,FALSE
Xray Projectomic Reconstruction Extracting Segment with Skeleton,XPRESS,,https://rumc-gcorg-p-public.s3.amazonaws.com/logos/challenge/721/XPRESS_logo_sq2-01.png,,https://xpress.grand-challenge.org/,,Grand Challenge,2023-02-06,,active,False,True,False,FALSE,True,False,FALSE,FALSE
autoPET-II,autoPET-II,,https://rumc-gcorg-p-public.s3.amazonaws.com/logos/challenge/722/autopet-5.png,Automated Lesion Segmentation in PET/CT - Domain Generalization,https://autopet-ii.grand-challenge.org/,,Grand Challenge,2023-02-28,2023-09-24,completed,True,True,True,FALSE,False,True,FALSE,FALSE
ToothFairy: Cone-Beam Computed Tomography Segmentation Challenge,toothfairy,,https://rumc-gcorg-p-public.s3.amazonaws.com/logos/challenge/723/logo.jpg,"This is the first edition of the ToothFairy challenge organized by the University of Modena and Reggio Emilia with the collaboration of Raudboud University. This challenge aims at pushing the development of deep learning frameworks to segment the Inferior Alveolar Canal (IAC) by incrementally extending the amount of publicly available 3D-annotated Cone Beam Computed Tomography (CBCT) scans.  CBCT modality is becoming increasingly important for treatment planning and diagnosis in implant dentistry and maxillofacial surgery. The three-dimensional information acquired with CBCT can be crucial to plan a vast number of surgical interventions with the aim of preserving noble anatomical structures such as the Inferior Alveolar Canal (IAC), which contains the homonymous nerve (Inferior Alveolar Nerve, IAN).  Deep learning models can support medical personnel in surgical planning procedures by providing a voxel-level segmentation of the IAN automatically extracted from CBCT scans.",https://toothfairy.grand-challenge.org/,,Grand Challenge,2023-06-30,,active,True,True,True,FALSE,False,True,FALSE,FALSE
SPIDER,spider,,https://rumc-gcorg-p-public.s3.amazonaws.com/logos/challenge/724/SPIDER_logo_square_jsl2NDu.png,,https://spider.grand-challenge.org/,,Grand Challenge,2023-07-26,2027-12-31,active,False,False,False,FALSE,False,True,FALSE,FALSE
LNQ2023,LNQ2023,,https://rumc-gcorg-p-public.s3.amazonaws.com/logos/challenge/725/LNQ-square.png,"Accurate lymph node size estimation is critical for staging cancer patients, initial therapeutic management, and in longitudinal scans, assessing response to therapy. Current standard practice for quantifying lymph node size is based on a variety of criteria that use unidirectional or bidirectional measurements on just one or a few nodes, typically on just one axial slice. But humans have hundreds of lymph nodes, any number of which may be enlarged to various degrees due to disease or immune response. While a normal lymph node may be approximately 5mm in diameter, a diseased lymph node may be several cm in diameter. The mediastinum, the anatomical area between the lungs and around the heart, may contain ten or more lymph nodes, often with three or more enlarged greater than 1cm. Accurate segmentation in 3D would provide more information to evaluate lymph node disease.",https://lnq2023.grand-challenge.org/,,Grand Challenge,2023-05-01,2023-09-30,completed,True,False,False,FALSE,True,True,FALSE,FALSE
ARCADE-MICCAI2023,ARCADE,,https://rumc-gcorg-p-public.s3.amazonaws.com/logos/challenge/726/aRCADE__1.jpg,,https://arcade.grand-challenge.org/,,Grand Challenge,2023-06-07,2023-09-20,completed,False,True,False,FALSE,True,True,FALSE,FALSE
Ultrasound Image Enhancement challenge 2023,UltrasoundEnhance2023,,https://rumc-gcorg-p-public.s3.amazonaws.com/logos/challenge/727/logo.png,,https://ultrasoundenhance2023.grand-challenge.org/,,Grand Challenge,2023-07-10,2023-08-31,completed,False,True,True,FALSE,True,False,FALSE,FALSE
SEG.A.  - Segmentation of the Aorta,MultiCenterAorta,,https://rumc-gcorg-p-public.s3.amazonaws.com/logos/challenge/729/logo_final_miccai.jpg,"Segmentation, modeling and visualization of the arterial tree are still a challenge in medical image analysis. The main track of this challenge deals with the fully automatic segmentation of the aortic vessel tree in computed tomography images. Optionally, teams can submit tailored solutions for meshing and visualization of the vessel tree.",https://multicenteraorta.grand-challenge.org/,https://doi.org/10.1016/j.media.2020.101773,Grand Challenge,2023-06-15,2023-08-15,completed,False,True,True,FALSE,False,True,FALSE,FALSE
Surgical Planning in Pediatric Neuroblastoma,SPPIN,,https://rumc-gcorg-p-public.s3.amazonaws.com/logos/challenge/730/SPINN_Logo_SB_2023_03_11-09_TnwZJgK.png,,https://sppin.grand-challenge.org/,,Grand Challenge,2023-08-10,2023-09-01,completed,True,True,False,FALSE,False,True,FALSE,FALSE
Foundation Model Prompting for Medical Image Classification,MedFM2023,,https://rumc-gcorg-p-public.s3.amazonaws.com/logos/challenge/731/logo640.png,The primary objective of this challenge is to promote the development and evaluation of model adaptation techniques for medical image classification to leverage the existing foundation models.,https://medfm2023.grand-challenge.org/,,Grand Challenge,2023-07-14,2033-10-15,active,True,True,True,FALSE,True,False,FALSE,FALSE
DENTEX - MICCAI23,DENTEX,,https://rumc-gcorg-p-public.s3.amazonaws.com/logos/challenge/732/logo_diseased.png,Dental Enumeration and Diagnosis on Panoramic X- rays Challenge,https://dentex.grand-challenge.org/,https://arxiv.org/abs/2303.06500,Grand Challenge,2023-04-30,2023-09-01,completed,False,True,True,FALSE,True,True,FALSE,FALSE
Topology-Aware Anatomical Segmentation of the Circle of Willis,TopCoW23,,https://rumc-gcorg-p-public.s3.amazonaws.com/logos/challenge/733/TopCow_logo.jpg,Segment the Circle of Willis (CoW) vessel components for both CTA and MRA,https://topcow23.grand-challenge.org/,https://arxiv.org/abs/2312.17670,Grand Challenge,2023-08-27,2023-10-25,completed,False,True,True,FALSE,False,True,FALSE,FALSE
SegRap 2023,SegRap2023,,https://rumc-gcorg-p-public.s3.amazonaws.com/logos/challenge/734/segrap-logo_cLCSrpZ.png,"A segmentation challenge with 200 patients (two modalities of CT images, 45 OARs and 2 GTVs).",https://segrap2023.grand-challenge.org/,,Grand Challenge,2023-07-09,2023-09-13,completed,True,True,True,FALSE,False,True,FALSE,FALSE
Low-dose Computed Tomography Perceptual Image Quality Assessment,LDCTIQAC2023,,https://rumc-gcorg-p-public.s3.amazonaws.com/logos/challenge/735/IQA_logo_3io1BcW.png,,https://ldctiqac2023.grand-challenge.org/,,Grand Challenge,2023-04-19,2023-07-28,completed,False,False,False,FALSE,False,True,FALSE,FALSE
CL-Detection 2023,CL-Detection2023,,https://rumc-gcorg-p-public.s3.amazonaws.com/logos/challenge/737/logo.png,Cephalometric landmark detection in lateral x-ray images,https://cl-detection2023.grand-challenge.org/,https://doi.org/10.1016/j.media.2016.02.004,Grand Challenge,2023-05-31,2023-08-15,completed,True,True,True,FALSE,False,True,FALSE,FALSE
Endoscopic surgical tool localization using tool presence labels,surgtoolloc23,,https://rumc-gcorg-p-public.s3.amazonaws.com/logos/challenge/738/grand-challenge_logo_2023.png,,https://surgtoolloc23.grand-challenge.org/,,Grand Challenge,2023-06-29,2023-09-20,completed,True,True,True,FALSE,False,True,FALSE,FALSE
OCELOT 2023: Cell Detection from Cell-Tissue Interaction,OCELOT2023,,https://rumc-gcorg-p-public.s3.amazonaws.com/logos/challenge/739/gc_loco_XeBK92j.png,,https://ocelot2023.grand-challenge.org/,https://arxiv.org/abs/2303.13110,Grand Challenge,2023-06-04,2023-08-04,completed,True,True,False,FALSE,False,True,FALSE,FALSE
Project AIR - commercial AI for lung nodule detection on CXR,pairlungnodulexr22,,https://rumc-gcorg-p-public.s3.amazonaws.com/logos/challenge/741/lung-nodules-cxr-logo.png,Head-to-head performance evaluation of commercially available AI products. This challenge shows the results for lung nodule detection on chest radiographs on a multicenter dataset (seven centers) from the Netherlands.,https://pairlungnodulexr22.grand-challenge.org/,,Grand Challenge,,2024-01-08,completed,False,False,False,FALSE,True,False,FALSE,FALSE
