title,slug,headline,logo,description,url,doi,platform,start_date,end_date,status,monetary_incentive,publication_incentive,speaking_incentive,other_incentive,file_submission,container_submission,notebook_submission,other_submission
The Trauma THOMPSON Challenge,THOMPSON-Challenge,,https://rumc-gcorg-p-public.s3.amazonaws.com/logos/challenge/742/ttlog_black_-_Copy.png,,https://thompson-challenge.grand-challenge.org/,,Grand Challenge,2023-09-01,,completed,True,True,True,FALSE,True,False,FALSE,FALSE
Hypoxic Ischemic Encephalopathy Lesion Segmentation Challenge,BONBID-HIE2023,,https://rumc-gcorg-p-public.s3.amazonaws.com/logos/challenge/743/hie.png,,https://bonbid-hie2023.grand-challenge.org/,,Grand Challenge,2023-07-01,2023-09-21,completed,False,True,True,FALSE,True,True,FALSE,FALSE
CHAIMELEON Open Challenges,CHAIMELEON,,https://rumc-gcorg-p-public.s3.amazonaws.com/logos/challenge/744/Logo_Grand_Challenge_-_2.png,A unique opportunity for scientists to advance cancer research with AI. The CHAIMELEON Open Challenges invites participants to collaborate to develop and train new AI-powered solutions driving innovation in cancer diagnosis and treatment.,https://chaimeleon.grand-challenge.org/,,Grand Challenge,2023-11-02,2024-03-15,completed,True,True,False,FALSE,True,True,FALSE,FALSE
Head and Neck Tumor Segmentation for MR-Guided Applications,HNTSMRG24,,https://rumc-gcorg-p-public.s3.amazonaws.com/logos/challenge/745/logo_v0.png,This challenge focuses on developing algorithms to automatically segment head and neck cancer gross tumor volumes on multi-timepoint MRI,https://hntsmrg24.grand-challenge.org/,,Grand Challenge,,,completed,False,False,False,FALSE,False,True,FALSE,FALSE
PANORAMA,PANORAMA,,https://rumc-gcorg-p-public.s3.amazonaws.com/logos/challenge/746/PANORAMA_logo_squared.png,Artificial Intelligence and Radiologists at Pancreatic Cancer Diagnosis in CT,https://panorama.grand-challenge.org/,,Grand Challenge,2024-04-22,,active,False,False,False,FALSE,False,True,FALSE,FALSE
Universal Lesion Segmentation Challenge '23,ULS23,,https://rumc-gcorg-p-public.s3.amazonaws.com/logos/challenge/747/ULS23_logo_aoB8tlx.png,,https://uls23.grand-challenge.org/,,Grand Challenge,2024-01-31,,active,False,False,False,FALSE,False,True,FALSE,FALSE
Justified Referral in AI Glaucoma Screening,JustRAIGS,,https://rumc-gcorg-p-public.s3.amazonaws.com/logos/challenge/749/Logo_XlR2vwf.png,,https://justraigs.grand-challenge.org/,,Grand Challenge,2024-01-08,2024-04-27,completed,False,False,False,FALSE,False,True,FALSE,FALSE
Light My Cells : Bright Field to Fluorescence Imaging Challenge,lightmycells,,https://rumc-gcorg-p-public.s3.amazonaws.com/logos/challenge/750/logo_light_my_cells.png,Join the Light My Cells France-Bioimaging challenge! Enhance biology and microscopy by contributing to the development of new image-to-image deep labelling methods. The task: predict the best-focused output images of several fluorescently labelled organelles from label-free transmitted light input images. Dive into the future of imaging with us! 🌐🔬 #LightMyCellsChallenge,https://lightmycells.grand-challenge.org/,,Grand Challenge,2024-03-15,2024-04-20,completed,False,False,False,FALSE,False,True,FALSE,FALSE
Diminished Reality for Emerging Applications in Medicine,DREAMING,,https://rumc-gcorg-p-public.s3.amazonaws.com/logos/challenge/752/isbi_dreaming_logo_gc.png,"The Diminished Reality for Emerging Applications in Medicine through Inpainting (DREAMING) challenge seeks to pioneer the integration of Diminished Reality (DR) into oral and maxillofacial surgery. While Augmented Reality (AR) has been extensively explored in medicine, DR remains largely uncharted territory. DR involves virtually removing real objects from the environment by replacing them with their background. Recent inpainting methods present an opportunity for real-time DR applications without scene knowledge. DREAMING focuses on implementing such methods to fill obscured regions in surgery scenes with realistic backgrounds, emphasizing the complex facial anatomy and patient diversity. The challenge provides a dataset of synthetic yet photorealistic surgery scenes featuring humans, simulating an operating room setting. Participants are tasked with developing algorithms that seamlessly remove disruptions caused by medical instruments and hands, offering surgeons an unimpeded view of the operative site.",https://dreaming.grand-challenge.org/,,Grand Challenge,2024-02-18,2024-05-08,completed,False,False,False,FALSE,False,True,FALSE,FALSE
Abdominal Circumference Operator-agnostic UltraSound measurement,ACOUSLIC-AI,,https://rumc-gcorg-p-public.s3.amazonaws.com/logos/challenge/753/acouslicai-logo_tjZmpqL.png,,https://acouslic-ai.grand-challenge.org/,,Grand Challenge,2024-05-05,2024-07-31,active,False,False,False,FALSE,False,True,FALSE,FALSE
The LEOPARD Challenge,LEOPARD,,https://rumc-gcorg-p-public.s3.amazonaws.com/logos/challenge/754/logo.png,,https://leopard.grand-challenge.org/,,Grand Challenge,2024-05-28,,active,False,False,False,FALSE,False,True,FALSE,FALSE
AutoPET III,AutoPET-III,,https://rumc-gcorg-p-public.s3.amazonaws.com/logos/challenge/755/autopet-2024.png,,https://autopet-iii.grand-challenge.org/,,Grand Challenge,2024-06-30,2024-09-15,upcoming,False,False,False,FALSE,False,True,FALSE,FALSE
AI4Life Microscopy Denoising Challenge,AI4Life-MDC24,,https://rumc-gcorg-p-public.s3.amazonaws.com/logos/challenge/756/Challenge_square.png,"Wellcome to AI4Life-MDC24! In this challenge, we want to focus on an unsupervised denoising of microscopy images. By participating, researchers can contribute to a critical area of scientific research, aiding in interpreting microscopy images and potentially unlocking discoveries in biology and medicine.",https://ai4life-mdc24.grand-challenge.org/,,Grand Challenge,,2024-06-30,active,False,False,False,FALSE,False,True,FALSE,FALSE
Ischemic Stroke Lesion Segmentation Challenge 2024,ISLES-24,,https://rumc-gcorg-p-public.s3.amazonaws.com/logos/challenge/757/ISLES24_1_c8Cz4NN.png,,https://isles-24.grand-challenge.org/,,Grand Challenge,2024-06-15,2024-08-15,upcoming,False,False,False,FALSE,False,True,FALSE,FALSE
Surgical Visual Understanding,surgvu24,,https://rumc-gcorg-p-public.s3.amazonaws.com/logos/challenge/758/grand-challenge_logo_2024.png,,https://surgvu24.grand-challenge.org/,,Grand Challenge,2024-08-05,2024-09-10,upcoming,False,False,False,FALSE,False,True,FALSE,FALSE
ToothFairy2: Multi-Structure Segmentation in CBCT Volumes,ToothFairy2,,https://rumc-gcorg-p-public.s3.amazonaws.com/logos/challenge/759/GrandChallenge-Logo.png,This is the second edition of the ToothFairy challenge organized by the University of Modena and Reggio Emilia with the collaboration of Radboud University Medical Center. The challenge is hosted by grand-challenge and is part of MICCAI2024.,https://toothfairy2.grand-challenge.org/,,Grand Challenge,2024-06-30,2024-08-16,upcoming,False,False,False,FALSE,False,True,FALSE,FALSE
Pelvic Bone Fragments with Injuries Segmentation Challenge,PENGWIN,,https://rumc-gcorg-p-public.s3.amazonaws.com/logos/challenge/760/PENGWIN_qZTjVoC.jpg,Pelvic fracture segmentation in CT and X-ray,https://pengwin.grand-challenge.org/,,Grand Challenge,2024-05-14,2024-07-31,active,False,False,False,FALSE,False,True,FALSE,FALSE
Multi-Class Segmentation of Aortic Branches and Zones in CTA,AortaSeg24,,https://rumc-gcorg-p-public.s3.amazonaws.com/logos/challenge/761/Grand_Challenge_Logo.png,3D Segmentation of Aortic Branches and Zones on Computed Tomography Angiography (CTA),https://aortaseg24.grand-challenge.org/,,Grand Challenge,2024-06-06,2024-08-16,active,False,False,False,FALSE,False,True,FALSE,FALSE
Automated Identification of Mod-Sev TBI Lesions,AIMS-TBI,,https://rumc-gcorg-p-public.s3.amazonaws.com/logos/challenge/762/AIMS-TBI_logo_G50gkm9.png,,https://aims-tbi.grand-challenge.org/,,Grand Challenge,2024-05-25,2024-08-16,active,False,False,False,FALSE,False,True,FALSE,FALSE
TopCoW 2024 Challenge,topcow24,,https://rumc-gcorg-p-public.s3.amazonaws.com/logos/challenge/763/TopCow24_Logo_V3.png,"Segment, classify, and detect the Circle of Willis (CoW) for both CTA and MRA",https://topcow24.grand-challenge.org/,https://arxiv.org/abs/2312.17670,Grand Challenge,,,completed,False,False,False,FALSE,False,False,FALSE,FALSE
Self-supervised learning for 3D light-sheet microscopy image seg,SELMA3D,,https://rumc-gcorg-p-public.s3.amazonaws.com/logos/challenge/766/logo_v2_AkZJGQC.jpg,,https://selma3d.grand-challenge.org/,,Grand Challenge,,,completed,False,False,False,FALSE,False,True,FALSE,FALSE
Cross-Organ and Cross-Scanner Adenocarcinoma Segmentation,COSAS,,https://rumc-gcorg-p-public.s3.amazonaws.com/logos/challenge/767/COSAS-SQ.png,,https://cosas.grand-challenge.org/,,Grand Challenge,2024-07-17,2024-09-03,upcoming,False,False,False,FALSE,False,True,FALSE,FALSE
Calibration and Uncertainty for multiRater Volume Assessment in,CURVAS,,https://rumc-gcorg-p-public.s3.amazonaws.com/logos/challenge/769/image_1_XAXhFzC.png,,https://curvas.grand-challenge.org/,,Grand Challenge,,,completed,False,False,False,FALSE,False,True,FALSE,FALSE
MONKEY challenge: Detection of inflammation in kidney biopsies,MONKEY,,https://rumc-gcorg-p-public.s3.amazonaws.com/logos/challenge/771/logo-monkey.png,MONKEY (Machine-learning for Optimal detection of iNflammatory cells in KidnEY),https://monkey.grand-challenge.org/,,Grand Challenge,,,completed,False,False,False,FALSE,False,False,FALSE,FALSE
